id;marca;nomeDaPeca;precoComDesconto;precoSemDesconto;Descricao;Tamanho;Condicao;Cores;Disponível;Data;Status
14864;Sem Marca;Jaqueta Jeans BAD;79;79;Jaqueta jeans com bolsos na frente. Possui detalhes coloridos nos bolsos, mangas, gola e costas.;G;Vintage;;VENDIDO;2018-11-17 01:35:46.393540;VERIFICADO
14865;By and By;Camisa Jeans By and By;39;39;Camisa jeans com barra desfiada. Possui bolsos na frente e botões maiores.;M;Vintage;;VENDIDO;2018-11-17 02:25:06.712592;VERIFICADO
14866;PUC;Camisa Floral PUC;35;35;Camisa de manga curta estampada.;M;Vintage;;VENDIDO;2018-11-17 02:40:06.216628;VERIFICADO
14867;Stroke;Camisa Navy Stroke;45;45;Camisa com bordado no pequeno na frente e gola listrada. A camisa é tamanho P, mas possui modelagem maior, vestindo também tamanho M.;P;Vintage;;VENDIDO;2018-11-17 03:31:28.899494;VERIFICADO
14868;Old Ridel;Camisa Old Ridel;59;59;Camisa xadrez de flanela com mangas compridas. Possui um bolso na frente.;M;Vintage;;VENDIDO;2018-11-17 02:35:38.870906;VERIFICADO
14869;GP;Jaqueta Jeans GP;89;89;Jaqueta jeans em perfeito estado com bolsos na frente.;M;Vintage;;VENDIDO;2018-11-17 03:06:51.013487;VERIFICADO
14870;Guess;Vestido Jeans Guess;49;49;Vestido jeans sem mangas com botões e bolsos na frente.;G;Vintage;;VENDIDO;2018-11-17 02:42:34.736235;VERIFICADO
14871;High Poisoned;Calça Jogger Mostarda;89;89;Calça jogger mostarda com elástico na cintura.;42;Vintage;;VENDIDO;2018-11-17 02:24:19.817979;VERIFICADO
14872;Hering;Camisa Xadrez Hering;39;39;Camisa de manga curta xadrez com dois bolsos na frente.;G;Vintage;;VENDIDO;2018-11-17 03:33:31.491949;VERIFICADO
14873;Untied;Camisa Estampada United;79;79;Camisa estampada de manga curta com um bolso na frente garimpada na Argentina.;G;Vintage;;VENDIDO;2018-11-17 01:20:02.151561;VERIFICADO
14874;Mr. Two;Camisa Xadrez Mr. Two;59;59;Camisa xadrez de manga comprida com um bolso na frente.;M;Vintage;;VENDIDO;2018-11-17 02:59:33.225257;VERIFICADO
14875;Beck's;Jaqueta Becks Customizada;119;119;Jaqueta jeans customizada com desenho do artista Nelson Baibich.;G;Vintage;;VENDIDO;2018-11-17 01:18:23.727723;VERIFICADO
14876;Legaiff;Short Alto Legaiff;59;59;Short jeans com cintura alta. Possui barra cortada e desfiada, podendo ser usado com ela dobrada.;34;Vintage;;VENDIDO;2018-11-17 02:53:54.049526;VERIFICADO
14877;LIII Le Mark;Camisa Xadrez Le Mark;59;59;Camisa xadrez de manga comprida com um bolso na frente.;G;Vintage;;VENDIDO;2018-11-17 03:23:38.557026;VERIFICADO
14878;Colcci;Calça Colcci;69;69;Calça skinny com detalhes desfiados nos bolsos.;40;Vintage;;VENDIDO;2018-11-17 03:30:11.014539;VERIFICADO
14879;Fun-wear;Camisa Estampada Fun-Wear;49;49;Camisa de manga curta estampada com um bolso na frente.;GG;Vintage;;VENDIDO;2018-11-17 03:28:18.093293;VERIFICADO
14880;Zara;Blusa Poá Zara;39;39;Blusa transparente com estampa de poá. Possui lastex nas barras e nos ombros.;PP;Vintage;;VENDIDO;2018-11-17 02:57:18.026132;VERIFICADO
14881;Korinex;Blusa Korinex;39;39;Blusa vintage com botões de âncora na frente, bordados nos bolsos e correntes nas costas.;G;Vintage;;VENDIDO;2018-11-17 01:16:08.869982;VERIFICADO
14882;Sem Marca;Camisa Margaridas;55;55;Camisa de manga curta estampada com um bolso na frente.;G;Vintage;;VENDIDO;2018-11-17 02:04:24.772104;VERIFICADO
14883;Fray Work;Jaqueta Fray Work;65;65;Jaqueta jeans com bolsos e botões na frente.;M;Vintage;;VENDIDO;2018-11-17 03:33:28.511822;VERIFICADO
14884;Sem Marca;Colete Marrom;37;37;Colete marrom com bege, possui botões na frente.;U;Vintage;;VENDIDO;2018-11-17 01:54:21.276398;VERIFICADO
14885;Casometro;Bermuda Jeans Casometro;37;37;Bermuda jeans.;38;Vintage;;VENDIDO;2018-11-17 02:29:18.572387;VERIFICADO
14886;Elgen Post;Camisa Floral EP;79;79;Camisa floral de manga curta garimpada na Argentina.;GG;Vintage;;VENDIDO;2018-11-17 03:11:24.043219;VERIFICADO
14887;Sem Marca;Camisa de Lese;35;35;Camisa branca de manga curta em lese.;GG;Vintage;;VENDIDO;2018-11-17 02:47:50.526329;VERIFICADO
14888;Sem Marca;Bandana USA;12;12;Bandana quadrada estampada.;U;Vintage;;VENDIDO;2018-11-17 01:32:20.272863;VERIFICADO
14889;Sem Marca;Blusa Estampada;35;35;Blusa com padronagem.;M;Vintage;;VENDIDO;2018-11-17 03:07:34.779371;VERIFICADO
14890;Clock House;Calça Jogger Preta;89;89;Calça jogger preta com elástico na cintura nunca usaca.;40;Novo;;VENDIDO;2018-11-17 02:37:06.154133;VERIFICADO
14891;DM;Camisa Creazione;55;55;Camisa estampada de manga curta com um bolso na frente.;GG;Vintage;;VENDIDO;2018-11-17 02:34:04.243200;VERIFICADO
14892;Blue Steel;Calça Jeans Estonada;59;59;Calça jeans skinny com elasticidade.;38;Vintage;;VENDIDO;2018-11-17 03:20:46.643024;VERIFICADO
14893;Sem Marca;Camisa Floral Candy;35;35;Camisa de manga curta floral com um bolso na frente e botões de coco. Possui pequenas manchas claras e algumas marcas de uso, mas que não comprometem a peça. Sua modelagem é grande.;P;Vintage;;VENDIDO;2018-11-17 02:10:35.578956;VERIFICADO
14894;Ops! Jeans;Bermuda Jeans Ops;37;37;Bermuda jeans com barra cortada e desfiada.;42;Vintage;;VENDIDO;2018-11-17 03:25:51.682965;VERIFICADO
14895;Sem Marca;Bandana Vermelha;9;9;Bandana quadrada estampada.;U;Vintage;;VENDIDO;2018-11-17 02:32:36.991138;VERIFICADO
14896;Lucky Brand;Camisa Lucky Brand;75;75;Camisa estampada de manga comprida com um bolso na frente. Garimpada na Argentina.;M;Vintage;;VENDIDO;2018-11-17 02:33:09.339137;VERIFICADO
14897;Blue Steel;Calça Acid Washed Alta;99;99;Calça jeans de cintura alta com lavagem diferenciada e elasticidade. Peça nunca usada.;42;Novo;;VENDIDO;2018-11-17 03:41:05.836065;VERIFICADO
14898;Youcom;Calça Alta Navy Blue;89;89;Calça jeans de cintura alta com elasticidade. Peça nunca usada.;40;Novo;;VENDIDO;2018-11-17 01:33:27.930259;VERIFICADO
14899;Zannup;Jaqueta Zannup;65;65;Jaqueta jeans com bolsos e botões na frente.;G;Vintage;;VENDIDO;2018-11-17 01:42:14.299244;VERIFICADO
14900;Modal Class;Camisa Modal Class;55;55;Camisa de manga curta com um bolso na frente e estampa miúda. Está em perfeito estado, as marcas nas fotos foram de molhados da passagem da peça.;M;Vintage;;VENDIDO;2018-11-17 01:32:30.190237;VERIFICADO
14901;Sexxes;Jaqueta Sexxes;59;59;Jaqueta jeans com lavagem diferenciada.;M;Vintage;;VENDIDO;2018-11-17 03:05:10.298722;VERIFICADO
14902;Gang Jeans;Calça Gang Jeans;89;89;Calça jeans de cintura alta com lavagem diferenciada, desfiados e elasticidade. Peça nunca usada.;40;Novo;;VENDIDO;2018-11-17 02:33:24.934798;VERIFICADO
14903;Zara;Camisa Floral Zara;65;65;Camisa slim floral de manga comprida em tecido bem leve.;M;Vintage;;VENDIDO;2018-11-17 03:24:47.999699;VERIFICADO
14904;Zara;Calça Resinada Zara;79;79;Calça skinny resinada. Tecido com pouca elasticidade.;40;Vintage;;VENDIDO;2018-11-17 02:44:32.681872;VERIFICADO
14905;New Time;Camisa New Time;49;49;Camisa estampada e manga curta com um bolso na frente.;P;Vintage;;VENDIDO;2018-11-17 03:23:24.818264;VERIFICADO
14906;Clock House;Calça Blue;65;65;Calça jeans skinny com elasticidade.;42;Vintage;;VENDIDO;2018-11-17 00:59:46.615466;VERIFICADO
14907;Alpargatas;Camisa Camuflada;59;59;Camisa camuflada de manga comprida com dois bolsos na frente.;G;Vintage;;VENDIDO;2018-11-17 03:35:32.910231;VERIFICADO
14908;Raybest;Bermuda Raybest;49;49;Bermuda de cintura alta vintage.;36;Vintage;;VENDIDO;2018-11-17 02:41:49.755042;VERIFICADO
14909;Pool;Bermuda Floral Banho;39;39;Bermuda de banho com estampa floral.;GG;Vintage;;VENDIDO;2018-11-17 02:46:27.910744;VERIFICADO
14910;Collins;Camisa Poá Colorido;35;35;Camisa de manga curta estampada.;M;Vintage;;VENDIDO;2018-11-17 02:42:02.260248;VERIFICADO
14911;Sierra West;Calça Alta Pink;65;65;Calça jeans de cintura alta rosa.;40;Vintage;;VENDIDO;2018-11-17 03:08:44.194640;VERIFICADO
14912;Sem Marca;Casaquinho de Veludo;49;49;Casaquinho peplum em veludo preto e estampado. Possui um botão na frente.;M;Vintage;;VENDIDO;2018-11-17 01:40:30.448474;VERIFICADO
14913;Gianni Versace S.p.a.;Short Alto Preto;49;49;Short preto jeans de cintura alta.;38;Vintage;;VENDIDO;2018-11-17 03:04:59.754937;VERIFICADO
14914;Rafaello;Colete Rafaello;39;39;Colete de lã com padronagem preto e branco. Possui botões na frente.;G;Vintage;;VENDIDO;2018-11-17 02:39:31.446885;VERIFICADO
14915;Zara;Vestido Zara Basic;69;69;Vestido branco reto, com dois bolsos na parte da frente.;M;Vintage;;VENDIDO;2018-11-17 01:35:55.960106;VERIFICADO
14916;Jóia de Pano;Jaqueta Vintage Camelo;79;79;Jaqueta vintage na cor camelo.;42;Vintage;;VENDIDO;2018-11-17 03:27:32.478118;VERIFICADO
14917;RG;Short de Couro;69;69;Short de couro legítimo. Possui forro.;38;Vintage;;VENDIDO;2018-11-17 03:04:20.060291;VERIFICADO
14918;Lyn;Camisa Floral de Seda;79;79;Camisa de seda pura com estampa floral.;GG;Vintage;;VENDIDO;2018-11-17 01:19:40.228055;VERIFICADO
14919;Leni's;Jaqueta Jeans Leni’s;79;79;Jaqueta jeans clara.;M;Vintage;;VENDIDO;2018-11-17 02:43:36.900354;VERIFICADO
14920;Sem Marca;Vestido Étnico Midi;49;49;Vestido leve com estampa étnica de comprimento midi. Cinto não incluso.;G;Vintage;;VENDIDO;2018-11-17 02:31:43.228802;VERIFICADO
14921;Convexo;Jaqueta Jeans Convexo;79;79;Jaqueta jeans clara ampla. Possui zíper e dois bolsos grandes na parte da frente.;M;Vintage;;VENDIDO;2018-11-17 02:53:44.433933;VERIFICADO
14922;St. Claus Denim & Co.;Short Alto St. Claus;49;49;Short de linho de cintura altíssima.;38;Vintage;;VENDIDO;2018-11-17 02:39:40.894029;VERIFICADO
14923;LP;Calça Alta Chumbo;69;69;Calça jeans reta de cintura alta na cor chumbo.;38;Vintage;;VENDIDO;2018-11-17 02:51:44.849167;VERIFICADO
14924;Sem Marca;Vestido Gold;69;69;Vestido em lamê dourado. Possui elástico na cintura e decote nas costas. Apresenta bastante elasticidade.;M;Vintage;;VENDIDO;2018-11-17 02:38:48.258653;VERIFICADO
14925;Levi's;Short Alto Levi’s;59;59;Short jeans de cintura alta com lavagem escura.;36;Vintage;;VENDIDO;2018-11-17 02:49:36.930682;VERIFICADO
14926;Pool;Camiseta Atitude;29;29;Camiseta preta com estampa na frente.;P;Vintage;;VENDIDO;2018-11-17 01:35:05.113659;VERIFICADO
14927;Youcom;Calça Alta Youcom;89;89;Calça jeans skinny de cintura alta com elastano. Cor: preto.;38;Novo;;VENDIDO;2018-11-17 02:10:07.385941;VERIFICADO
14928;Sem Marca;Vestido Floral Midi;55;55;Vestido leve com estampa floral de comprimento midi. Cinto não incluso.;G;Vintage;;VENDIDO;2018-11-17 02:38:20.645936;VERIFICADO
14929;Opera Rock;Short Alto Opera Rock;59;59;Short jeans de cintura alta.;38;Vintage;;VENDIDO;2018-11-17 03:29:56.878139;VERIFICADO
14930;Stumpf;Colete Stumpf;45;45;Colete de lã com padronagem. Possui botões na frente.;G;Vintage;;VENDIDO;2018-11-17 03:32:08.464534;VERIFICADO
14931;Planeta Azul;Short Alto Planeta Azul;59;59;Short jeans de cintura alta com lavagem clara.;34;Vintage;;VENDIDO;2018-11-17 03:21:53.060254;VERIFICADO
14932;Sem Marca;Camisa Navy;59;59;Camisa com estampa navy.;M;Vintage;;VENDIDO;2018-11-17 01:17:36.533994;VERIFICADO
14933;Renner;Camisa 70’s;69;69;Camisa preta estampada com leve transparência.;G;Vintage;;VENDIDO;2018-11-17 02:56:39.085190;VERIFICADO
14934;Jogê;Vestido Longo Veludo;59;59;Vestido longo amplo com mangas compridas. Possui padronagem geométrica em veludo azul e preto.;U;Vintage;;VENDIDO;2018-11-17 02:47:23.594533;VERIFICADO
14935;Someday;Calça Militar Someday;69;69;Calça jeans verde militar com bolsos nas laterais.;36;Vintage;;VENDIDO;2018-11-17 03:21:08.962438;VERIFICADO
14936;Ninita;Colete Floral Ninita;49;49;Colete floral de tecido estruturado. Possui botões na parte da frente.;P;Vintage;;VENDIDO;2018-11-17 03:09:28.637457;VERIFICADO
14937;Blue Steel;Calça Jeans Blue Steel;69;69;Calça jeans com lavagem escura. Bolsos com detalhes em vermelho. Possui partes levemente desfiadas.;44;Vintage;;VENDIDO;2018-11-17 02:39:49.974348;VERIFICADO
14938;Vavoom;Calça Jeans Vavoom;69;69;Calça jeans com lavagem clara. Apresenta pequenas manchas e partes levemente desfiadas.;42;Vintage;;VENDIDO;2018-11-17 02:24:50.704557;VERIFICADO
14939;Blue Steel;Blazer Jeans Blue Steel;69;69;Blazer jeans com lavagem escura. Apresenta partes levemente desfiadas.;M;Vintage;;VENDIDO;2018-11-17 02:54:46.777053;VERIFICADO
14940;Pool;Jaqueta Jeans Pool;89;89;Jaqueta jeans com lavagem escura. Possui efeito tie-dye leve no tecido.;G;Vintage;;VENDIDO;2018-11-17 03:16:27.981172;VERIFICADO
14941;BS;Camisa Jeans BS;69;69;Camisa jeans de manga curta com recortes em dois tons diferentes.;GG;Vintage;;VENDIDO;2018-11-17 02:27:51.756989;VERIFICADO
14942;Zoomp;Bermuda por Nelson Baibich;89;89;Bermuda jeans clara customizada pelo artista Nelson Baibich. Apresenta partes desfiadas.;40;Vintage;;VENDIDO;2018-11-17 03:38:53.723699;VERIFICADO
14943;Land's End;Camisa Jeans Land’s End;79;79;Camisa jeans de manga comprida, com bordado preto na parte da frente em forma de búfalo.;G;Vintage;;VENDIDO;2018-11-17 03:11:17.285343;VERIFICADO
14944;Quik Jean;Bermuda Quik Jean;49;49;Bermuda jeans desfiada com lavagem escura.;42;Vintage;;VENDIDO;2018-11-17 02:20:13.109156;VERIFICADO
14945;Triton;Bermuda Jeans Triton;49;49;Bermuda jeans desfiada com lavagem clara.;38;Vintage;;DISPONIVEL;2018-11-17 02:30:31.295519;VERIFICADO
14946;Taco Jeans;Jaqueta Jeans;89;89;Jaqueta jeans vintage com lavagem escura.;M;Vintage;;VENDIDO;2018-11-17 02:51:50.028793;VERIFICADO
14947;Piuf's;Colete Piuf’s Jeans;79;79;Colete jeans com lavagem escura. Possui mangas desfiadas.;M;Vintage;;VENDIDO;2018-11-17 01:33:46.884759;VERIFICADO
14948;Zara Man;Calça Jeans Zara Man;69;69;Calça jeans com lavagem escura. Possui partes levemente desfiadas.;40;Vintage;;VENDIDO;2018-11-17 03:03:11.406216;VERIFICADO
14949;LG;Camisa Havaiana LG;49;49;Camisa com estampa floral havaiana, nas cores azul, verde e branco. Mangas curtas.;G;Vintage;;VENDIDO;2018-11-17 02:56:13.109915;VERIFICADO
14950;Levi's;Camisa Estampada Levi’s;79;79;Camisa de manga curta com estampa floral. Possui um bolso na frente.;GG;Vintage;;VENDIDO;2018-11-17 02:13:52.780824;VERIFICADO
14951;Kanwin;Camisa Estampada Kanwin;69;69;Camisa de manga curta preta com estampa em branco. Possui um bolso na frente.;G;Vintage;;VENDIDO;2018-11-17 02:08:53.700662;VERIFICADO
14952;Reyn Spooner;Camisa Reyn Spooner;79;79;Camisa de manga curta com estampa floral. Possui um bolso na frente.;G;Vintage;;VENDIDO;2018-11-17 03:37:50.861795;VERIFICADO
14953;Cafuza;Camisa Floral;79;79;Camisa de manga curta com estampa floral. Possui dois bolsos na frente.;P;Vintage;;VENDIDO;2018-11-17 01:31:08.995920;VERIFICADO
14954;Sem Marca;Camisa Branca Estampada;59;59;Camisa branca de manga curta com estampa nas cores azul e bege. Possui um bolso na frente.;G;Vintage;;VENDIDO;2018-11-17 02:52:47.037442;VERIFICADO
14955;Quiksilver;Camisa Estampada Quiksilver;69;69;Camisa de manga curta com estampa floral nas cores azul e branco. Possui um bolso na frente.;P;Vintage;;VENDIDO;2018-11-17 02:29:53.717369;VERIFICADO
14956;Damyller;Camisa Estampada Damyller;79;79;Camisa branca de manga curta com estampa nas cores azul, verde e roxo. Possui um bolso na frente.;G;Vintage;;VENDIDO;2018-11-17 03:08:27.617937;VERIFICADO
14957;HK;Camisa Xadrez KF;59;59;Camisa de manga curta com estampa xadrez. Possui um bolso na frente.;M;Vintage;;VENDIDO;2018-11-17 01:41:32.363802;VERIFICADO
14958;Wit Ford;Camisa Estampada Wit Ford;79;79;Camisa de manga curta com estampa floral. Não é aberta na frente, possui botões frontais apenas próximos à gola. Possui um bolso na frente.;GG;Vintage;;VENDIDO;2018-11-17 02:17:25.563948;VERIFICADO
14959;Alternativa;Camisa Estampa Abstrata;79;79;Camisa de manga curta com estampa abstrata. Possui dois bolsos na frente.;M;Vintage;;VENDIDO;2018-11-17 03:26:37.863061;VERIFICADO
14960;Sem Marca;Camisa Estampada;69;69;Camisa estampada de manga curta. Possui um bolso na frente.;G;Vintage;;VENDIDO;2018-11-17 02:54:49.984418;VERIFICADO
14961;Pierre St. Martin;Blazer Pierre St. Martin;79;79;Blazer boyfriend com bolsos frontais e dois botões.;46;Vintage;;VENDIDO;2018-11-17 03:25:41.281616;VERIFICADO
14962;Ellaben;Blusa Ellaben;39;39;Blusa de malha com estampa floral.;G;Vintage;;VENDIDO;2018-11-17 02:19:12.887805;VERIFICADO
14963;Solezia;Blusa Solezia;19;45;Blusa cigana estampada transparente. Possui amarração no decote e nas mangas.;G;Vintage;;DISPONIVEL;2018-11-17 02:38:51.829143;VERIFICADO
14964;Luna Modas;Blusa Boho;15;45;Blusa de manga comprida com amarração no decote.;P;Novo;;DISPONIVEL;2018-11-17 02:55:53.543474;VERIFICADO
14965;Queda Livre;Colete Jeans Queda Livre;59;59;Colete jeans com bolsos na frente e barras desfiadas.;P;Vintage;;VENDIDO;2018-11-17 03:27:04.106496;VERIFICADO
14966;Tegui;Jaqueta Jeans Tegui;99;99;Jaqueta jeans mais compridinha, com 3 bolsos na parte da frente. É forrada com tecido xadrez.;P;Vintage;;VENDIDO;2018-11-17 03:08:34.109112;VERIFICADO
14967;Sem Marca;Colete Floral;15;39;Colete com estampa floral na frente. Possui três botões e amarração atrás.;U;Vintage;;DISPONIVEL;2018-11-17 02:18:28.069704;VERIFICADO
14968;Sem Marca;Blusa Floral Elástico;45;45;Blusa preta com estampa floral. É soltinha e possui elástico na cintura.;M;Vintage;;VENDIDO;2018-11-17 03:33:34.555513;VERIFICADO
14969;Pro World;Camisa Pássaros;49;49;Camisa de manga curta estampada com transparência. Possui mangas bufantes e botões perolados.;M;Novo;;VENDIDO;2018-11-17 03:25:38.011920;VERIFICADO
14970;Sem Marca;Camisa Floral Verde Água;45;45;Camisa de manga curta verde água transparente, com estampa floral. Possui botões dourados.;M;Vintage;;VENDIDO;2018-11-17 03:21:19.163909;VERIFICADO
14971;Sem Marca;Camisa Floral Borboletas;39;39;Camisa transparente com estampa floral sem mangas. Possui botões de pedras com amarração na gola.;M;Vintage;;VENDIDO;2018-11-17 02:44:29.616341;VERIFICADO
14972;Sem Marca;Blusa Estampada Ampla;49;49;Blusa ampla estampada com botões na frente.;G;Vintage;;VENDIDO;2018-11-17 02:34:40.116224;VERIFICADO
14973;System;Blusa Bordada System;15;29;Blusa com alcinhas reguláveis na cor pink, com bordados em miçangas e lantejoulas na gola.;38;Vintage;;DISPONIVEL;2018-11-17 01:53:21.277500;VERIFICADO
14974;Nary;Jaqueta Jeans Nary;79;79;Jaqueta jeans branca com bolsos e botões na frente.;M;Vintage;;VENDIDO;2018-11-17 01:33:05.813563;VERIFICADO
14975;Armaggi;Camiseta Estampada Armaggi;49;49;Camiseta estampada com gola.;M;Vintage;;VENDIDO;2018-11-17 01:20:46.792199;VERIFICADO
14976;Maria Helena Guedes;Jaqueta Maria Helena Guedes;89;89;Jaqueta jeans mostarda com detalhe nos bolsos em veludo cotelê. Possui etiqueta vintage atrás.;M;Vintage;;VENDIDO;2018-11-17 02:36:59.422405;VERIFICADO
14977;Sem Marca;Camisa Estampada Spikes;49;49;Camisa sem mangas estampada, com gola e vista em tecido preto. Possui botões em spikes dourados.;P;Vintage;;VENDIDO;2018-11-17 01:18:33.359613;VERIFICADO
14978;TNG;Vestido TNG;69;69;Vestido preto com saia em bandage e parte de cima caída.;M;Vintage;;DISPONIVEL;2018-11-17 03:40:27.838563;VERIFICADO
14979;Sem Marca;Blusa Estampada Marinho;45;45;Blusa marinho estampada, apresenta leve transparência. Possui botôes na parte da frente.;G;Vintage;;VENDIDO;2018-11-17 03:19:32.223767;VERIFICADO
14980;Sem Marca;Blusa Cigana Xadrez;29;49;Blusa ciganinha transparente com estampa xadrez.;P;Vintage;;DISPONIVEL;2018-11-17 02:43:13.577656;VERIFICADO
14981;Marfinno;Camisa Estampada Marfinno;15;45;Camisa sem mangas estampada.;38;Vintage;;DISPONIVEL;2018-11-17 02:50:31.429835;VERIFICADO
14982;Bokker;Camisa Bokker;39;39;Camisa sem mangas colorida.;M;Vintage;;VENDIDO;2018-11-17 02:47:04.357721;VERIFICADO
14983;Sem Marca;Vestido Verde Água;45;45;Vestido estampado nas cores verde água e branco.;M;Vintage;;VENDIDO;2018-11-17 02:54:17.287508;VERIFICADO
14984;Style Biz Inc.;Camisa Bicolor Style;59;59;Camisa bicolor ampla, na cor off white com gola e vista em preto. É mais comprida na parte das costas.;M;Vintage;;VENDIDO;2018-11-17 02:43:50.292380;VERIFICADO
14985;Tomany;Saia Tomany;15;45;Saia bege com zíper atrás.;PP;Vintage;;VENDIDO;2018-11-17 02:19:59.726118;VERIFICADO
14986;Inco;Camisa Vintage Poá;59;59;Camisa estampada com poás nas cores branco e marrom. É vintage e possui gola bem pontuda.;M;Vintage;;VENDIDO;2018-11-17 03:14:42.234397;VERIFICADO
14987;Sem Marca;Macacão Floral P&B;89;89;Macacão midi floral preto e branco com botões na parte da frente. Possui decote nas costas com amarração.;M;Vintage;;VENDIDO;2018-11-17 03:39:26.510764;VERIFICADO
14988;Club Room;Camisa Club Room;79;79;Camisa estampada de manga comprida. Possui um bolso na frente.;P;Vintage;;VENDIDO;2018-11-17 03:25:08.350272;VERIFICADO
14989;Alfred;Blazer Alfred;79;79;Blazer com dois botões na frente e bolsos.;44;Vintage;;VENDIDO;2018-11-17 01:19:24.143115;VERIFICADO
14990;Johemar;Colete Marrom Losangos;49;49;Colete com botões e padronagem na frente.;M;Vintage;;VENDIDO;2018-11-17 03:14:38.331854;VERIFICADO
14991;Byblon;Camisa Bicolor;49;49;Camisa ampla de manga curta. Tecido com pouca transparência e detalhe atrás com botões.;50;Vintage;;VENDIDO;2018-11-17 01:17:49.433344;VERIFICADO
14992;Sem Marca;Blusa Flores Azuis;15;45;Camisa de manga curta com estampa floral.;G;Vintage;;DISPONIVEL;2018-11-17 03:29:59.937831;VERIFICADO
14993;Fit;Blusa Fit;49;49;Blusa ampla estampada.;M;Vintage;;VENDIDO;2018-11-17 02:45:10.979131;VERIFICADO
14994;Sem Marca;Camisa Linhas Abstratas;39;39;Camisa estampada de manga comprida.;G;Vintage;;VENDIDO;2018-11-17 02:23:24.624908;VERIFICADO
14995;Cozy Cafe;Vestido Preto Bordado;19;69;Vestido preto com bordado no decote. Possui decote nas costas com alça cruzada.;M;Novo;;DISPONIVEL;2018-11-17 03:15:35.691978;VERIFICADO
14996;French Kiss;Vestido Longo French;19;69;Vestido longo floral de alcinha com detalhe de renda na barra.;M;Vintage;;DISPONIVEL;2018-11-17 02:47:26.788526;VERIFICADO
14997;Pinoducci;Camisa Jeans Pinoppuci;55;55;Camisa jeans, tecido com elasticidade.;46;Vintage;;VENDIDO;2018-11-17 01:20:59.262908;VERIFICADO
14998;Blue Steel;Calça Jeans Blue Steel;29;69;Calça jeans skinny. Tecido com elasticidade.;40;Vintage;;DISPONIVEL;2018-11-17 03:29:53.419168;VERIFICADO
14999;Blue Steel;Calça Preta Blue Steel;29;69;Calça jeans skinny. Tecido com elasticidade.;44;Vintage;;DISPONIVEL;2018-11-17 01:35:08.370049;VERIFICADO
15000;Byzance;Short Jeans Cruz;19;55;Short jeans de cintura alta com barra desfiada. Possui tachas bordadas na frente.;42;Vintage;;DISPONIVEL;2018-11-17 01:43:39.061125;VERIFICADO
15001;Dardak;Short Alto Dardak;29;49;Short jeans de cintura alta com barra cortada e dobrada.;40;Vintage;;DISPONIVEL;2018-11-17 02:47:07.709386;VERIFICADO
15002;Sem Marca;Saia High Waisted Marrom;19;39;Saia de cintura alta com fenda lateral.;36;Vintage;;DISPONIVEL;2018-11-17 02:35:48.564772;VERIFICADO
15003;Cia das Indias;Vestido Cia das Índias;29;49;Vestido de manga curta estampado com forro.;M;Vintage;;DISPONIVEL;2018-11-17 02:41:55.929257;VERIFICADO
15004;Guertt's;Bermuda Guertt’s;49;49;Bermuda jeans com barra cortada e desfiada.;38;Vintage;;VENDIDO;2018-11-17 02:28:13.036628;VERIFICADO
15005;Damyller;Short Preto Damyller;49;49;Short preto de cintura alta.;40;Vintage;;VENDIDO;2018-11-17 03:13:12.666540;VERIFICADO
15006;Tacoma;Jaqueta Jeans Vintage;89;89;Jaqueta jeans vintage com mangas mais amplas e amarração.;M;Vintage;;VENDIDO;2018-11-17 03:41:44.991546;VERIFICADO
15007;Luna Modas;Blusa Boho Petróleo;29;49;Blusa de manga comprida com modelagem estilo boho.;P;Vintage;;DISPONIVEL;2018-11-17 02:16:49.100278;VERIFICADO
15008;Surs Side;Blusa Cigana Girassol;19;39;Blusa com modelagem ciganinha estampada.;M;Vintage;;DISPONIVEL;2018-11-17 01:42:52.274500;VERIFICADO
15009;Sem Marca;Short Alto Preto;29;49;Short preto de cintura alta em tecido levinho.;36;Vintage;;DISPONIVEL;2018-11-17 02:34:22.956681;VERIFICADO
15010;Naguchi;Blusa Naguschico;15;39;Regata transparente com estampa na frente.;M;Vintage;;DISPONIVEL;2018-11-17 01:19:43.300050;VERIFICADO
15011;Fiorucci;Colete Jeans Fiorucci;89;89;Colete jeans com botões na frente.;G;Vintage;;VENDIDO;2018-11-17 03:00:43.167345;VERIFICADO
15012;Suez;Jaqueta Jeans Suez;89;89;Jaqueta jeans com bolsos pequenos na frente.;M;Vintage;;VENDIDO;2018-11-17 03:12:15.038473;VERIFICADO
15013;Lakok;Short Lakok;59;59;Short jeans de cintura alta com barra desfiada. Possui bordado no bolso traseiro e desfiados em volta.;36;Vintage;;VENDIDO;2018-11-17 03:36:00.768377;VERIFICADO
15014;Rubicon;Top Rubicon;35;35;Top preto com listras brilhosas.;P;Vintage;;VENDIDO;2018-11-17 03:13:05.642446;VERIFICADO
15015;Gap;Jaqueta Marrom GAP;59;59;Jaqueta jeans marrom com bolsos falsos.;P;Vintage;;VENDIDO;2018-11-17 02:34:36.819321;VERIFICADO
15016;Visual Top;Blusa Visual Top;13;39;Regata com estampa de oncinha.;M;Vintage;;DISPONIVEL;2018-11-17 02:46:18.228208;VERIFICADO
15017;Cheroy;Blusa Cheroy;29;35;Blusa de alcinha com estampa floral. Possui um pequeno furinho no forro, que não compromete a peça.;P;Vintage;;DISPONIVEL;2018-11-17 02:48:38.089742;VERIFICADO
15018;Hering;Calça Hrng;59;59;Calça skinny verde musgo, tecido com elasticidade.;38;Vintage;;VENDIDO;2018-11-17 02:09:29.913786;VERIFICADO
15019;Authentic;Macacão Jeans Authentic;79;79;Macacão jeans com botões na lateral e bolsos.;P;Vintage;;VENDIDO;2018-11-17 03:12:49.031415;VERIFICADO
15020;Catwalk;Macacão Floral;29;69;Macacão jeans floral com botões na lateral e bolso na frente.;P;Vintage;;DISPONIVEL;2018-11-17 01:22:58.267200;VERIFICADO
15021;Pink Dress;Camisa Marrom Floral;15;49;Camisa marrom transparente com estampa floral. Possui detalhe na gola para amarrar.;M;Vintage;;VENDIDO;2018-11-17 01:35:59.172988;VERIFICADO
15022;Lemma;Camisa Flanela;59;59;Camisa de flanela xadrez de manga comprida.;G;Vintage;;VENDIDO;2018-11-17 03:19:15.561478;VERIFICADO
15023;Request;Calça Request;89;89;Calça jeans roxa com costuras bordô.;40;Vintage;;VENDIDO;2018-11-17 03:12:35.222584;VERIFICADO
