id;marca;nomeDaPeca;precoComDesconto;precoSemDesconto;Descricao;Tamanho;Condicao;Cores;Disponível;Data;Status
21770;Clock House;Blusa Clock House;35;35;Blusa de modelagem ampla. Decote canoa e recortes nas mangas. Parte da frente em cetim e o restante da peça em malha.;P;Vintage;;DISPONIVEL;2018-11-17 02:29:50.612187;VERIFICADO
21771;Maria Bonita;Colete Maria Bonita;69;69;Colete em tricô com 5 botões. Peça em ótimo estado de conservação.;G;Vintage;;DISPONIVEL;2018-11-17 03:34:30.843203;VERIFICADO
21772;London Fog;Casaco London Fog;159;159;Casaco 7/8, estilo gabardine, tecido impermeável. Modelagem reta, fechamento por botões, dois bolsos na parte da frente. A peça apresenta uma leve manchinha cinza de uso na manga direita. Garimpado em Buenos Aires, Argentina.;G;Vintage;;DISPONIVEL;2018-11-17 03:29:09.231306;VERIFICADO
21773;Zara Man;Sapato Bicolor Zara;59;59;Sapato masculino bicolor, estilo moderno. Em couro preto e branco. A sola apresenta leve desgaste de uso. A parte de cima está em ótimo estado de conservação.;42;Vintage;;DISPONIVEL;2018-11-17 02:28:44.457281;VERIFICADO
21774;Sem Marca;Lenço Azul e Vermelho;49;49;Lenço grande quadrado, com estampa em tons de azul, vermelho e branco. O tecido é um crepe bem leve e com textura macia. Pode ser usado como top, amarrado no cabelo, no pescoço, na bolsa, na calça como um cinto, como você quiser! Peça vintage.;U;Vintage;;DISPONIVEL;2018-11-17 03:08:23.352106;VERIFICADO
21775;Nutrisport;Sobretudo Nutrisport;179;179;Casaco impermeável, estilo capa e/ou sobretudo. Possui três bolsos externos na parte da frente, fechamento por 7 botões. Acompanha faixa para ajuste na cintura.;G;Vintage;;DISPONIVEL;2018-11-17 01:34:50.885987;VERIFICADO
21776;Sem Marca;Colete Cinza e Vermelho;49;49;Colete de lã cinza com detalhes em vermelho, quentinho e confortável. Modelagem reta.;M;Vintage;;DISPONIVEL;2018-11-17 03:36:34.573151;VERIFICADO
21777;Rica Lewis;Calça Jeans Rica Lewis;99;99;Calça jeans vintage, com modelagem reta e ampla. Jeans claro, com cintura mais alta.;42;Vintage;;VENDIDO;2018-11-17 01:18:11.473959;VERIFICADO
21778;Damyller;Casaco Capa DMYLR;99;99;Casaco capa, modelagem estilo anos 40, em tecido resinado impermeável. Forrada internamente. Possui fechamento por botões e duas aberturas para passagem dos braços.;U;Vintage;;VENDIDO;2018-11-17 02:42:37.915568;VERIFICADO
21779;H&M;Camisa H&M;39;39;Camisa estampada sem gola. Modelagem ampla. Fechamento por botões. Ao invés de punhos possui elástico fininho para melhor ajuste do volume das mangas. Tecido fino de leve transparência.;M;Vintage;;VENDIDO;2018-11-17 02:27:19.261378;VERIFICADO
21780;Sem Marca;Casaco Lã Batida;139;139;Casaco de lã batida preto, com 2 bolsos externos e mais 2 internos, forrada em matelassê, fechamento por botões padrão.;52;Vintage;;VENDIDO;2018-11-17 01:32:07.152401;VERIFICADO
21781;Stazione;Vestido Vintage Stazione;99;99;Vestido vintage curtinho, de alças com decote transpassado. O tecido é aveludado e possui elastano. Fechamento por zíper invisível na parte das costas.;P;Vintage;;VENDIDO;2018-11-17 02:55:31.642423;VERIFICADO
21782;Sidewalk;Sapato Preto Sidewalk;99;99;Sapato preto de couro cano médio, com cadarço. Está em ótimo estado de conservação, mas apresenta algumas marcas de uso.;42;Vintage;;DISPONIVEL;2018-11-17 02:53:11.165862;VERIFICADO
21783;Hury;Jaqueta Cotelê Hury;199;199;Jaqueta preta de veludo cotelê Hury. Fechamento por botões de pressão prata. Estilo anos 90.;P;Vintage;;DISPONIVEL;2018-11-17 02:56:00.194799;VERIFICADO
21784;Jar-Mod;Blazer Xadrez Jar-Mod;129;129;Blazer xadrez marrom e preto, em tecido texturizado. Tem dois bolsos na parte da frente, e dois botões. Totalmente forrado.;46;Vintage;;DISPONIVEL;2018-11-17 02:10:01.032726;VERIFICADO
21785;Ferracini;Coturno Ferracini;99;99;Coturno semi-novo marrom. Fechamento por cadarço e zíper lateral para melhor praticidade no calçar. Calçado de alta durabilidade. Modelagem de forma grande.;42;Vintage;;DISPONIVEL;2018-11-17 02:17:19.514103;VERIFICADO
21786;Sem Marca;Jaqueta Vintage Dupla Face;299;299;Jaqueta vintage dupla face, estilo bomber. De um lado é lisa, na cor vinho, e do outro tem estampa floral. Possui camadas de fibra internas. Tem 4 bolsos, dois na parte externa e dois na parte interna. Fechamento por botões de pressão. Apresenta algumas partes um pouco desbotadas na gola, o que não compromete a peça. Garimpada em Buenos Aires, Argentina.;GG;Vintage;;DISPONIVEL;2018-11-17 03:34:43.656858;VERIFICADO
11773;Sem Marca;Suéter Triângulos;29;53;Suéter com padronagem e fio dourado.;P;Vintage;;VENDIDO;2018-11-17 02:43:32.900449;VERIFICADO
21788;Black Riret;Casaco Black Rivet;149;149;Casaco Lã Batida, 4 bolsos externos e 2 internos, Fechamento duplo, lapela alongada forrado;M;Vintage;;DISPONIVEL;2018-11-17 01:54:08.623739;VERIFICADO
21789;Sem Marca;Suéter Lhamas;89;89;Suéter Lhamas, de manga comprida todo marrom com detalhes em branco e padronagem branco e azul nas mangas, barra e gola.;M;Vintage;;VENDIDO;2018-11-17 03:28:49.799099;VERIFICADO
21790;Quarry Planet Dry;Jaqueta Jeans Planet;199;199;Jaqueta jeans clara, com modelagem reta. Possui 4 bolsos externos, botões dourado vintage. Garimpada em Buenos Aires, Argentina.;G;Vintage;;DISPONIVEL;2018-11-17 03:22:09.379692;VERIFICADO
21791;Sem Marca;Lenço Floral Laranja;39;39;Lenço grande quadrado, com estampa floral laranja. O tecido é leve e fresquinho. Pode ser usado como top, amarrado no cabelo, no pescoço, na bolsa, na calça como um cinto, como você quiser! Peça vintage.;U;Vintage;;DISPONIVEL;2018-11-17 03:13:36.068631;VERIFICADO
21793;Pelican Fly;T-Shirt Fries Before Guys;29;29;Camiseta com detalhe de ribana na gola e nas mangas. Estampada somente na parte da frente.;P;Vintage;;VENDIDO;2018-11-17 02:09:06.458401;VERIFICADO
21795;Sem Marca;Vestido Longo P&B;79;79;Vestido longo com estampa geométrica em preto e branco. A parte de cima e a cintura ficam ajustadas ao corpo. Já a parte debaixo, a saia do vestido, é mais solta e possui duas fendas na parte da frente. A peça possui forro e zíper lateral. Encontra-se em ótimo estado de conservação. A etiqueta da peça marca tamanho P, mas é uma peça bem ampla, veste G.;P;Vintage;;VENDIDO;2018-11-17 01:53:24.705162;VERIFICADO
21798;UFO;Jaqueta Jeans UFO;199;199;Jaqueta UFO Garimpada em Buenos Aires, com 4 bolsos externos, modelagem reta, oversized, estilo anos 90.;G;Vintage;;VENDIDO;2018-11-17 03:15:16.791272;VERIFICADO
21812;UFO Way;Jaqueta Grey;99;99;Jaqueta jeans cinza. Modelagem ampla e reta. Peça nunca usada. Possui dois bolsos na parte da frente. Fechamento por botões de metal.;G;Novo;;VENDIDO;2018-11-17 02:53:14.631950;VERIFICADO
21819;Sem Marca;Camisa Vintage Zebra;99;99;Camisa com estampa de zebra, de manga curta. Muito bem conservada e bem levinha.;M;Vintage;;VENDIDO;2018-11-17 01:30:30.533118;VERIFICADO
21821;Hawaiin Dreams;Jaqueta Hawaiian Dreams;149;149;Jaqueta para frio intenso, forrada e impermeável, fechamento no zíper e botão de pressão, possui a bandeira americana estampada na parte direita do peito, tem 3 bolsos externos e 2 internos.;G;Vintage;;VENDIDO;2018-11-17 01:19:33.876162;VERIFICADO
21826;ANG;Jaqueta Jeans ANG;199;199;Jaqueta Jeans Ang forrada com uma estampa floral rosinha, acinturada, com 4 bolsos externos, oversized, estilo anos 90. Peça vintage, garimpada em Buenos Aires, Argentina.;M;Vintage;;VENDIDO;2018-11-17 01:31:28.357120;VERIFICADO
21831;Kardiê;Cardigan Kardiê;89;89;Cardigan de lã sintética, com detalhes geométricos. Fechamento com 6 botões e bolsos laterais. Peça vintage ideal para se usar em meia-estação.;G;Vintage;;VENDIDO;2018-11-17 03:04:43.319742;VERIFICADO
21833;Valéria;Cardigan Valéria;49;49;Cardigan decote redondo. Fechamento por botões. Com lã merino na composição. A peça está em ótimo estado de conservação. Produzido e garimpado em Argentina, Buenos Aires.;M;Vintage;;VENDIDO;2018-11-17 01:15:59.394779;VERIFICADO
21840;C&A;Calça Bomber;149;149;Calça esportiva estilo bomber. Possui elástico na cintura e cordão para regulagem. Na parte da frente possui dois bolsos com zíper. As barras das pernas possuem elástico e zíper na vertical para ajustes. Peça garimpada em Montevideo, Uruguai.;GG;Vintage;;VENDIDO;2018-11-17 02:49:43.379875;VERIFICADO
15247;Levi's;Colete Jeans Levi’s;129;129;Colete jeans com 4 bolsos na parte da frente. Garimpado em Buenos Aires.;M;Vintage;;VENDIDO;2018-11-17 01:22:36.244468;VERIFICADO
17775;Primavera Firenze;Camisa Firenze;79;79;Camisa made in Italy. Vintage. Mangas com cava ampla. Na altura dos ombros apresenta detalhes em pregas que acrescentam volume a peça. ;M;Vintage;;VENDIDO;2018-11-17 01:40:17.427398;VERIFICADO
17776;Scuzzatti;Shorts Alfaiataria Scuzzatti;69;69;Short alfaiataria com dois bolsos faca na parte da frente, e dois atrás com fechamento em botões. ;42;Vintage;;DISPONIVEL;2018-11-17 03:40:31.014269;VERIFICADO
17777;Thayse;Vestido de Tricô Thayse;99;99;Vestido midi de tricô preto, reto, com mangas longas. O decote é assimétrico.;P;Vintage;;DISPONIVEL;2018-11-17 03:34:12.289222;VERIFICADO
17778;Sem Marca;Saia Lápis;59;59;Saia lápis em lã acrílica. Possui fenda para movimentação, zíper e colchetes na parte de atrás. ;M;Vintage;;DISPONIVEL;2018-11-17 03:37:53.924719;VERIFICADO
17779;Duca di Bard;Trench Coat Duca di Bard;149;249;Trench coat estilo capa, forrado. Possui 2 bolsos na parte na frente. Abotoamento invisível. Não acompanha cinto. A peça é feita em Cupro, uma fibra natural ecofriendly, feita a partir da recuperação do linter do algodão (o caroço do algodão, que normalmente é descartado pela indústria têxtil após a retirada da pluma do mesmo). Feito na Itália, garimpado em Buenos Aires.;M;Vintage;;DISPONIVEL;2018-11-17 01:33:02.551845;VERIFICADO
17780;Carducci;Suéter Long Carducci;99;159;Suéter alongado com aberturas laterais. Estampado em jacquard e detalhes em fio de lurex. Peça vintage garimparada em Buenos Aires, Argentina. ;M;Vintage;;VENDIDO;2018-11-17 03:37:31.103318;VERIFICADO
17781;Di Gianni;Shorts Couro Cintura Super Alta;99;99;Shorts vintage em couro com cintura super alta. Possui dois bolsos na parte da frente.;G;Vintage;;DISPONIVEL;2018-11-17 02:33:28.277872;VERIFICADO
17782;Nutrisport;Casaco Lã Batida Vermelho;99;149;Casaco lã batida com forro. Possui dois bolsos na parte da frente. Fechamento com cinco botões. ;42;Vintage;;VENDIDO;2018-11-17 03:21:32.289465;VERIFICADO
17783;Forever 21;Vestido de Veludo Forever 21;89;89;Vestido curto de veludo com decote em V, cintura marcada com cós e saia rodada. Peça nova, nunca usada, ainda com etiqueta original da marca.;P;Novo;;VENDIDO;2018-11-17 03:18:40.182280;VERIFICADO
17784;Sem Marca;Camisa Vintage Marrom;89;89;Camisa vintage marrom com padronagem na mesma cor, que forma desenhos em textura fosca e brilhante. A gola e a vista apresentam detalhes arredondados em toda a sua extensão. O abotoamento é invisível. Não possui costura na cava, sendo a manga e o corpo em uma dó estrutura. Possui pregas no ombro e no punho, o que deixam a manga super ampla.;M;Vintage;;DISPONIVEL;2018-11-17 03:04:36.764016;VERIFICADO
17785;Sem Marca;Suéter de Tricô Handmade;99;159;Suéter em tricô estampado. Feito á mão. Vintage. Peça garimada em Buenos Aires, Argentino. ;M;Vintage;;DISPONIVEL;2018-11-17 03:13:32.876940;VERIFICADO
17786;Strajman;Casaco de Pelo Bege;199;349;Casaco de pelo fake bege, com forro em tecido vermelho. A textura do pelo forma listras verticais em toda a peça. Possui dois bolsos na parte da frente. Peça vintage, garimpada em Buenos Aires, Argentina.;M;Vintage;;VENDIDO;2018-11-17 02:52:24.084382;VERIFICADO
17787;Petit infant;Jaqueta Bomber Jeans;129;199;Jaqueta bomber jeans com mangas em veludo cotelê. Forrada com fibra no corpo e mangas. Possui dois bolsos na parte da frente. ;PP;Vintage;;VENDIDO;2018-11-17 01:43:25.946130;VERIFICADO
17788;Levi Strauss & Co.;Mom Jeans Preta Levi’s 512;129;129;Calça jeans de cintura alta, com pernas retas, estilo mom jeans. Peça vintage, da marca Levi’s.;34;Vintage;;VENDIDO;2018-11-17 02:56:19.446779;VERIFICADO
17789;Atlantic Connection;Camisa Estampada Vintage;99;99;Camisa estampada vintage, com sete botões e um bolso frontal. Made in U.S.A.;GG;Vintage;;VENDIDO;2018-11-17 02:10:16.739091;VERIFICADO
17790;French Dressing;Mom Jeans Vintage Cintura Altíssima;129;129;Calça jeans vintage de cintura super alta e pernas retas, estilo mom jeans. Não possui bolsos na parte das costas, apenas na parte da frente. É uma peça ampla, no tamanho 16 americano, veste o tamanho 44 brasileiro. Garimpada em Buenos Aires.;44;Vintage;;VENDIDO;2018-11-17 02:38:35.031820;VERIFICADO
17791;Sem Marca;Jaqueta de Couro Perfecto;199;299;Jaqueta de couro natural, estilo pefecto, ampla e forrada. Possui 2 bolsos com zíper na parte da frente. Detalhe em zíper prateado nas mangas, que ajusta levemente a largura dos punhos. Apresenta desgastes de uso que não comprometem a peça. A manga direita apresenta um furo pequeno.;G;Vintage;;VENDIDO;2018-11-17 02:32:11.794203;VERIFICADO
17792;Sem Marca;Poncho Amplo com Franjas;89;89;Poncho amplo de lã com padronagem em tons de marrom. Barrado e franjas em lã preta. Também pode ser usado como cachecol, ideal para o frio. Garimpado em Buenos Aires.;U;Vintage;;VENDIDO;2018-11-17 02:39:37.648270;VERIFICADO
17793;Sem Marca;Cardigan Tranças;49;79;Cardigan em lã acrílica. Padronagem tranças. Possui cinco botões na parte da frente. ;M;Vintage;;VENDIDO;2018-11-17 01:21:35.875490;VERIFICADO
17794;Sem Marca;Casaco de Pelo Preto;199;349;Casaco de pelo preto, com forro em matelassê. Possui dois bolsos na parte da frente. Originalmente possuía botões que foram removidos, e os caseados foram fechados com costura à mão. Peça vintage, garimpada em Buenos Aires, Argentina. ;G;Vintage;;DISPONIVEL;2018-11-17 01:32:13.896653;VERIFICADO
17795;MZ Sweaters;Cardigan Padronagem MZ;49;69;Cardigan de lã marrom, com padronagem nas cores roxo e preto. Não é forrado. Fechamento por botões.;P;Vintage;;DISPONIVEL;2018-11-17 02:46:31.029690;VERIFICADO
17796;Chocker;Jaqueta Perfecto Étnica;119;119;Jaqueta estilo perfecto, estampa étnica em tear. Possui dois bolsos na parte da frente. O detalhe em couro sintético nos ombros que apresentam alguns desgastes.Acabamento desfiado. ;G;Vintage;;VENDIDO;2018-11-17 03:19:42.774313;VERIFICADO
17797;Sem Marca;Maxi Cardigan Hand Made;69;89;Maxi cardigan feito á mão com linha peluciada. Meia manga. ;U;Vintage;;DISPONIVEL;2018-11-17 02:55:57.109802;VERIFICADO
17798;Durante;Jaqueta de Couro Cropped Vintage;229;359;Jaqueta de couro natural, curta, em estilo bomber com elástico interno na parte das costas. Possui recortes em couro nas cores preto, vermelho e off white. As mangas são amplas. Gola estilo perfecto. Apresenta dois bolsos na parte da frente, zíperes pretos e um cinto fixo apenas na parte da frente. Totalmente forrada. Peça vintage, anos 80, garimpada em Buenos Aires.;M;Vintage;;VENDIDO;2018-11-17 03:38:44.260712;VERIFICADO
17799;Sem Marca;Suéter Alpaca;69;69;Suéter lã de alpaca. Padronagens lhamas. ;PP;Vintage;;VENDIDO;2018-11-17 03:12:18.183995;VERIFICADO
17800;Jar Mod;Blazer Boyfriend;89;89;Blazer boyfriend vermelho. Vintage. Possui ombreiras. Dois bolsos falsos na parte da frente. Dois botões para fechamento.;48;Vintage;;VENDIDO;2018-11-17 02:15:14.486862;VERIFICADO
17801;J.M.CLaughlin;Suéter J.M.Claughlin;89;89;Sueter made in Uruguay. Padronagem em Jacquard. 100% lã Merino. Garimpado em Buenos Aires.;PP;Vintage;;VENDIDO;2018-11-17 03:07:51.314946;VERIFICADO
17802;Sem Marca;Suéter Amplo Geométrico;89;149;Suéter de lã com padronagem geométrica colorida. Amplo e reto, estilo oversized. Garimpado em Buenos Aires.;G;Vintage;;VENDIDO;2018-11-17 02:54:40.347626;VERIFICADO
17803;Renner;Echarpe Menta;29;29;Echarpe 100% lã acrílica.;U;Vintage;;DISPONIVEL;2018-11-17 03:01:00.592938;VERIFICADO
17804;Youcom;Calça Black Cintura Alta;69;69;Calça jeans skinny cintura super alta na cor preta. ;40;Vintage;;VENDIDO;2018-11-17 03:26:30.732462;VERIFICADO
17805;Sem Marca;Capa Vintage de Lã Batida;299;299;Capa vintage de lã batida azul marinho. Não possui mangas, apresenta aberturas na parte da frente para passar os braços. Dois bolsos grandes na parte da frente, fechamento por botões, totalmente forrada. Ideal para frio intenso, e para ser usada sobre outro casaco. É uma peça unissex e ampla, sem marcação de ombros, por isso se adapta a diferentes tipos de corpos. Vintage, garimpada em Buenos Aires.;GG;Vintage;;VENDIDO;2018-11-17 02:26:48.718065;VERIFICADO
17806;Sketch;Cardigan com Capuz Sketch;89;149;Cardigan de lã com padronagem geométrica. Possui capuz e fechamento por botões.;M;Vintage;;VENDIDO;2018-11-17 03:26:57.358698;VERIFICADO
17807;Daus;Blazer Vermelho Daus;69;69;Blazer vermelho acinturado, com ombreiras. Apresenta bolsos falsos na parte da frente. É forrado.;42;Vintage;;DISPONIVEL;2018-11-17 03:17:21.675941;VERIFICADO
17808;;Bomber Jacket de Couro Stephan’s;99;189;Jaqueta de couro natural, estilo bomber, com elástico interno nas laterais da barra. É forrada, possui 2 bolsos na parte da frente. Mangas com punho em ribana. Fechamento por zíper na parte da frente. Apresenta desgastes de uso que não comprometem a peça.;Warning:  Invalid argument supplied for foreach() in /home/garimpar/public_html/wp-content/themes/wowmall/woocommerce/single-product/short-description.php on line 56;;;VENDIDO;2018-11-17 03:32:51.876811;VERIFICADO
17809;Sem Marca;Casaco de Pelo Marrom;349;349;Casaco de pelo marrom, forrado. Possui dois bolsos na parte da frente. Fechamento por ganchinhos. Peça vintage, garimpada em Buenos Aires, Argentina. ;M;Vintage;;DISPONIVEL;2018-11-17 02:58:18.033333;VERIFICADO
17810;Sem Marca;Casaco de Pelo Caramelo Oversized;249;399;Casaco de pelo vintage, na cor caramelo, oversized, totalmente forrado. Possui dois bolsos na parte da frente. Apresenta fechamento na parte da frente por encaixe em argolas, com pressão. A peça apresenta diferentes tonalidades de cor. Peça bem pesada, para frio intenso. Garimpado em Buenos Aires, Argentina.;G;Vintage;;DISPONIVEL;2018-11-17 02:09:36.096414;VERIFICADO
17811;Regina Misk;Colete Tricot;59;59;Colete curto em tricô. Possui três botões na parte da fente e padronagem geométrica. ;P;Vintage;;DISPONIVEL;2018-11-17 03:18:24.012492;VERIFICADO
17812;Sem Marca;Casaco de Pelo Vermelho;249;249;Casaco de pelo fake vermelho, totalmente forrado. Possui ombreiras. Fechamento por ganchinhos na parte da frente. Peça vintage, garimpada em Buenos Aires, Argentina.;M;Vintage;;VENDIDO;2018-11-17 03:16:21.374815;VERIFICADO
17813;Levi's;Mom Jeans Levi’s 569;129;129;Calça jeans de cintura alta, com pernas retas, estilo mom jeans. Peça vintage, da marca Levi’s.;36;Vintage;;VENDIDO;2018-11-17 03:37:05.308597;VERIFICADO
17814;Stress;Jaqueta Western Franjas;199;299;Jaqueta em camurça estilo western forrada, com franjas na parte da frente, costas e mangas. Possui dois bolsos na frente. Made in Argentina. ;G;Vintage;;DISPONIVEL;2018-11-17 02:48:32.058951;VERIFICADO
17815;Youcom;Calça Verde Militar Cintura Alta;69;69;Calça jeans skinny cintura super alta verde militar.  ;40;Vintage;;DISPONIVEL;2018-11-17 02:08:47.601318;VERIFICADO
17816;High Standard;Blazer Cotelê High Standard;69;69;Blazer em veludo cotelê bege. Forrado, com dois bolsos na parte da frente. Modelagem acinturada. Fechamento por botões. Apresenta alguns desgastes de uso, que não comprometem a peça.;G;Vintage;;VENDIDO;2018-11-17 02:35:35.920761;VERIFICADO
17817;Gabicci;Mom Jeans Gabucci;129;129;Calça jeans de cintura alta, com pernas retas, estilo mom jeans. Peça vintage, garimpada em Buenos Aires, Argentina. ;34;Vintage;;VENDIDO;2018-11-17 02:50:35.064380;VERIFICADO
17818;Sem Marca;Cachecol Listras;25;25;Cachecol listrado em tons terrosos. ;U;Vintage;;VENDIDO;2018-11-17 03:35:10.323241;VERIFICADO
17819;Youcom;Calça Mostarda Cintura Alta;69;69;Calça jeans skinny cintura super alta na cor mostarda.  ;40;Vintage;;DISPONIVEL;2018-11-17 02:16:58.683926;VERIFICADO
17820;Amita;Suéter Vintage Colorido;79;99;Suéter vintage em lã acrílica com estampa floral vibrante nas cores amarelo, vermelho e verde. Tem modelagem mais curta. Made in Italy.;M;Vintage;;VENDIDO;2018-11-17 03:34:36.990986;VERIFICADO
17821;Forever 21;Calça Jeans Cintura Alta;69;69;Calça jeans skinny cintura super alta na cor indigo blue.;40;Vintage;;DISPONIVEL;2018-11-17 01:54:44.534304;VERIFICADO
17822;Sem Marca;Suéter Estampa Geométrica;79;99;Suéter vintage em lã acrílica com estampa geométrica no corpo e nas mangas. ;M;Vintage;;DISPONIVEL;2018-11-17 03:24:03.980985;VERIFICADO
17823;Youcom;Calça Caramelo Cintura Alta;69;69;Calça jeans skinny cintura super alta na cor caramelo. ;40;Vintage;;DISPONIVEL;2018-11-17 03:16:44.056387;VERIFICADO
17824;Morton Bernard;Trend Coat Morton Bernard;89;169;Casaco estilo trend coat. Made in Yugoslávia. Possui dois bolsos na parte da frente e cinto para ajuste na parte de trás. ;40;Vintage;;VENDIDO;2018-11-17 03:31:52.666819;VERIFICADO
17825;Sem Marca;Blazer Ajustado;59;59;Blazer com forro. Acinturado e mais curto na parte de trás. Possui dois bolsos embutidos na parte da frente;P;Vintage;;VENDIDO;2018-11-17 02:24:16.792184;VERIFICADO
15259;Sem Marca;Colete Listras e Formas;59;59;Colete de lã com padronagem na parte frontal. Possui fechamento com botões.;M;Vintage;;VENDIDO;2018-11-17 02:49:00.788930;VERIFICADO
15265;Levi's;Sobretudo Jeans com Pelos Levi’s;199;199;Sobretudo jeans acinturado. Apresenta pelo sintético na gola e na parte interna da pala e da vista. Possui bolsos na parte da frente. Garimpado em Buenos Aires, Argentina.;P;Vintage;;VENDIDO;2018-11-17 02:34:33.652160;VERIFICADO
14249;Cabine A;Short Alto Cabine;50;50;Short de linho com cintura alta. Não possui passador de cinto (o único que aparece nas fotos foi retirado), e a barra da perna é comprida, podendo ser usada dobrada como na modelo. Peça nova com etiqueta.;38;Vintage;;VENDIDO;2018-11-17 02:49:27.055873;VERIFICADO
15271;Sem Marca;Suéter Étnico Gola;99;99;Suéter branco com padronagem colorida. Possui gola com botões na parte da frente. Garimpado em Buenos Aires, Argentina.;G;Vintage;;VENDIDO;2018-11-17 02:32:08.685145;VERIFICADO
15277;Macowens;Casaco Militar Macowens;89;149;Blazer azul marinho estilo militar. Possui 3 bolsos externos e 3 bolsos internos. É forrado. Garimpado em Buenos Aires, Argentina.;52;Vintage;;DISPONIVEL;2018-11-17 02:48:25.536527;VERIFICADO
15283;Sem Marca;Cardigan Forrado com Pelos;89;199;Cardigan vermelho em lã sintética, com padronagem de renas. Possui forro de pelo sintético em toda a parte interna e capuz, com exceção das mangas. Tem dois bolsos na frente. Fechamento por botões na frente. Garimpado em Buenos Aires, Argentina.;M;Vintage;;VENDIDO;2018-11-17 02:43:10.503688;VERIFICADO
14601;Le Poulet;Camisa Le Poulet;49;49;Camisa de manga curta estampada com um bolso na frente.;G;Vintage;;VENDIDO;2018-11-17 02:24:10.395620;VERIFICADO
13888;Marisa;Suéter Cropped;48;48;Suéter curto com padronagem. Possui gola ampla com botões laterais.;P;Vintage;;VENDIDO;2018-11-17 01:32:41.049921;VERIFICADO
13889;Sem Marca;Cardigan Vintage;46;46;Cardigan com padronagem e botões na frente. Possui tecido mais firme e grosso.;P;Vintage;;VENDIDO;2018-11-17 03:11:20.866972;VERIFICADO
13891;Sem Marca;Vestido Rabiscos;40;40;Vestido estampado com amarração nos ombros e na cintura.;P;Vintage;;VENDIDO;2018-11-17 03:05:13.563106;VERIFICADO
13896;Sem Marca;Suéter Ruby;39;63;Suéter curto com padronagem.;P;Vintage;;VENDIDO;2018-11-17 03:26:27.225765;VERIFICADO
13897;Sem Marca;Suéter Vintage;50;50;Suéter com padronagem, gola e botões.;U;Vintage;;VENDIDO;2018-11-17 01:40:57.622046;VERIFICADO
13899;Sem Marca;Suéter Tons de Marrom;70;70;Suéter com padronagem.;U;Vintage;;VENDIDO;2018-11-17 02:10:10.460625;VERIFICADO
13900;Lã Art;Cardigan Art;75;75;Cardigan com diferentes padronagens e texturas. Possui botões na frente.;M;Vintage;;VENDIDO;2018-11-17 02:24:41.130727;VERIFICADO
13902;Tom e Jerry;Cardigan Mickey;51;51;Cardigan estampado com botões. Possui pequenos desgastes de uso.;M;Vintage;;VENDIDO;2018-11-17 03:37:23.318785;VERIFICADO
13903;Grapefruit;Kimono Estampado;70;70;Kimono estampado com transparência.;U;Vintage;;VENDIDO;2018-11-17 01:08:46.804915;VERIFICADO
13908;Siegel;Vestido Jeans Siegel;40;40;Vestido jeans com zíper nas costas.;P;Vintage;;VENDIDO;2018-11-17 03:26:20.175398;VERIFICADO
13910;Sem Marca;Suéter Midnight;52;52;Suéter curto com padronagem.;P;Vintage;;VENDIDO;2018-11-17 01:21:57.975851;VERIFICADO
13915;Graça;Suéter Graça Marinho;62;62;Suéter de tricot com padronagem e ombreiras.;P;Vintage;;VENDIDO;2018-11-17 02:56:09.831729;VERIFICADO
13917;Sem Marca;Suéter Geométrico;48;48;Suéter de tricot com padronagem na frente.;M;Vintage;;VENDIDO;2018-11-17 02:50:41.559475;VERIFICADO
13918;Sem Marca;Poncho Off-white;50;50;Poncho de tricot com franjas na barra.;U;Vintage;;VENDIDO;2018-11-17 02:37:22.471778;VERIFICADO
13919;Dicuore;Suéter Dicuore;68;68;Suéter de tricot com padronagem e ombreiras.;M;Vintage;;VENDIDO;2018-11-17 03:23:55.913791;VERIFICADO
13920;Filo di Luce;Suéter Filo Di Luce;65;65;Suéter de tricot com padronagem.;P;Vintage;;VENDIDO;2018-11-17 03:18:08.030007;VERIFICADO
13922;Sem Marca;Suéter Chestnut;64;64;Suéter de tricot com padronagem.;M;Vintage;;VENDIDO;2018-11-17 03:15:20.108880;VERIFICADO
14239;Sem Marca;Saia de Laise;40;40;Saia de laise com zíper lateral embutido.;P;Vintage;;VENDIDO;2018-11-17 01:17:45.951113;VERIFICADO
13925;Vhayse;Cardigan P&B;70;70;Cardigan com padronagem e duas fileiras de botões na frente.;M;Vintage;;VENDIDO;2018-11-17 02:27:25.133878;VERIFICADO
